{
  "assumption_flags": [
    {
      "assumed_value": 0.15,
      "caveat": "Assumed fraction of service duration removed by pre-arrival intake; validate against real visit anatomy per customer before quoting externally.",
      "lever": "prep_in_queue.duration_reduction"
    },
    {
      "assumed_value": 0.5,
      "caveat": "Assumed fraction of would-be incompletes caught by prep (default midpoint of the 40-60% range); validate per customer.",
      "lever": "prep_in_queue.incomplete_reduction"
    },
    {
      "assumed_value": 0.02,
      "caveat": "Assumed fraction of visits resolved digitally before arrival; reported separately, never blended into served. Validate per customer.",
      "lever": "deflection.rate"
    }
  ],
  "attribution": [
    {
      "lever": "matching",
      "share_of_combined_gain": 24.5699
    },
    {
      "lever": "appointment_smoothing",
      "share_of_combined_gain": 40.738
    },
    {
      "lever": "prep_in_queue",
      "share_of_combined_gain": 31.4137
    },
    {
      "lever": "deflection",
      "share_of_combined_gain": 3.7224
    },
    {
      "lever": "running_late",
      "share_of_combined_gain": -0.444
    }
  ],
  "focus_recommendation": [
    {
      "employee_id": "E1",
      "focus_services": [
        "FA"
      ],
      "qualified_services": [
        "CA",
        "AD",
        "FA"
      ],
      "rationale": "Focus on FA (1.40x vs team avg 1.13x); colleagues cover CA (0.80x vs 1.30x), AD (1.00x vs 1.07x) faster on average."
    },
    {
      "employee_id": "E2",
      "focus_services": [
        "AD"
      ],
      "qualified_services": [
        "CA",
        "RG",
        "AD"
      ],
      "rationale": "Focus on AD (1.30x vs team avg 1.07x); colleagues cover CA (1.20x vs 1.30x), RG (1.10x vs 1.15x) faster on average."
    },
    {
      "employee_id": "E3",
      "focus_services": [
        "CA"
      ],
      "qualified_services": [
        "CA",
        "RG",
        "AV"
      ],
      "rationale": "Focus on CA (1.50x vs team avg 1.30x); colleagues cover RG (1.00x vs 1.15x), AV (1.30x vs 1.40x) faster on average."
    },
    {
      "employee_id": "E4",
      "focus_services": [
        "CA",
        "RG"
      ],
      "qualified_services": [
        "CA",
        "RG",
        "FA"
      ],
      "rationale": "Focus on CA (1.60x vs team avg 1.30x), RG (1.20x vs team avg 1.15x); colleagues cover FA (0.90x vs 1.13x) faster on average."
    },
    {
      "employee_id": "E5",
      "focus_services": [
        "AV"
      ],
      "qualified_services": [
        "AD",
        "FA",
        "AV"
      ],
      "rationale": "Focus on AV (1.50x vs team avg 1.40x); colleagues cover AD (0.90x vs 1.07x), FA (1.10x vs 1.13x) faster on average."
    },
    {
      "employee_id": "E6",
      "focus_services": [
        "CA",
        "RG",
        "AD"
      ],
      "qualified_services": [
        "CA",
        "RG",
        "AD"
      ],
      "rationale": "Focus on CA (1.40x vs team avg 1.30x), RG (1.30x vs team avg 1.15x), AD (1.10x vs team avg 1.07x)."
    }
  ],
  "guardrail_warnings": [
    {
      "lever": "appointment_smoothing",
      "message": "Solo lever 'appointment_smoothing' degrades appointment p90 lateness vs baseline (0.0 -> 5.2 min). The combined lever set is the guardrail-gated configuration.",
      "p90_lateness_baseline": 0.0002,
      "p90_lateness_solo": 5.1548
    }
  ],
  "meta": {
    "engine_version": "golden",
    "monte_carlo_days": 200,
    "random_seed": 42,
    "scenario_name": "State University One-Stop \u2014 Semester-Start Surge",
    "schema_version": "1.0.0"
  },
  "metrics": {
    "abandoned_per_day": {
      "baseline": 17.785,
      "ci95_high": -82.2623,
      "ci95_low": -88.6683,
      "delta_pct": -85.4653,
      "optimized": 2.585
    },
    "appointment_punctuality": {
      "baseline": {
        "max_lateness_min": 29.4289,
        "p50_lateness_min": 0.0,
        "p90_lateness_min": 0.0002,
        "pct_acceptable": 0.9936,
        "pct_on_time": 0.9868
      },
      "optimized": {
        "max_lateness_min": 74.6061,
        "p50_lateness_min": 0.0,
        "p90_lateness_min": 0.5916,
        "pct_acceptable": 0.9885,
        "pct_on_time": 0.9628
      }
    },
    "csat_5pt": {
      "baseline": 4.0,
      "optimized": 4.3914
    },
    "incomplete_time_cost_min_per_day": 0.0,
    "makespan_min": {
      "baseline": 22.953,
      "ci95_high": -47.2513,
      "ci95_low": -60.2982,
      "delta_pct": -53.7747,
      "optimized": 10.6101
    },
    "mean_csat": {
      "baseline": 71.3605,
      "ci95_high": 11.9876,
      "ci95_low": 10.6326,
      "delta_pct": 11.3101,
      "optimized": 79.4315
    },
    "mean_wait_min": {
      "baseline": 42.8156,
      "ci95_high": -76.8842,
      "ci95_low": -82.265,
      "delta_pct": -79.5746,
      "optimized": 8.7453
    },
    "p90_wait_min": {
      "baseline": 104.8705,
      "ci95_high": -80.3204,
      "ci95_low": -86.4267,
      "delta_pct": -83.3735,
      "optimized": 17.4363
    },
    "resolved_digitally_per_day": 5.05,
    "served_per_day": {
      "baseline": 214.79,
      "ci95_high": 8.5841,
      "ci95_low": 7.264,
      "delta_pct": 7.924,
      "optimized": 231.81
    },
    "turned_away_per_day": {
      "baseline": 18.155,
      "ci95_high": -79.3398,
      "ci95_low": -92.3484,
      "delta_pct": -85.8441,
      "optimized": 2.57
    }
  },
  "per_lever_impact": [
    {
      "lever": "matching",
      "mean_csat_delta_pts": -6.5676,
      "mean_wait_delta_pct": -33.1159,
      "p90_wait_delta_pct": -15.0875,
      "served_per_day_delta_pct": 5.7219
    },
    {
      "lever": "appointment_smoothing",
      "mean_csat_delta_pts": 5.7134,
      "mean_wait_delta_pct": -54.9074,
      "p90_wait_delta_pct": -50.0667,
      "served_per_day_delta_pct": 3.1752
    },
    {
      "lever": "prep_in_queue",
      "mean_csat_delta_pts": 3.4784,
      "mean_wait_delta_pct": -42.34,
      "p90_wait_delta_pct": -40.1229,
      "served_per_day_delta_pct": 10.2682
    },
    {
      "lever": "deflection",
      "mean_csat_delta_pts": 0.1802,
      "mean_wait_delta_pct": -5.0171,
      "p90_wait_delta_pct": -5.2255,
      "served_per_day_delta_pct": -0.4307
    },
    {
      "lever": "running_late",
      "mean_csat_delta_pts": 0.1337,
      "mean_wait_delta_pct": 0.5984,
      "p90_wait_delta_pct": 0.7041,
      "served_per_day_delta_pct": 0.1513
    }
  ],
  "waterfall": [
    {
      "label": "Baseline (FIFO, as run today)",
      "levers_active": [],
      "mean_csat": 71.3605,
      "mean_wait_min": 42.8156,
      "p90_wait_min": 104.8705,
      "served_per_day": 214.79,
      "step": 0
    },
    {
      "delta_vs_baseline_pct": {
        "mean_wait_min": -33.1159,
        "served_per_day": 5.7219
      },
      "label": "+ Focus matching & routing",
      "levers_active": [
        "matching"
      ],
      "mean_csat": 64.7929,
      "mean_wait_min": 28.6369,
      "p90_wait_min": 89.0482,
      "served_per_day": 227.08,
      "step": 1
    },
    {
      "delta_vs_baseline_pct": {
        "mean_wait_min": -57.331,
        "served_per_day": 3.8503
      },
      "label": "+ Appointment smoothing",
      "levers_active": [
        "matching",
        "appointment_smoothing"
      ],
      "mean_csat": 77.0022,
      "mean_wait_min": 18.269,
      "p90_wait_min": 45.0699,
      "served_per_day": 223.06,
      "step": 2
    },
    {
      "delta_vs_baseline_pct": {
        "mean_wait_min": -78.2991,
        "served_per_day": 8.8901
      },
      "label": "+ Prep-in-queue",
      "levers_active": [
        "matching",
        "appointment_smoothing",
        "prep_in_queue"
      ],
      "mean_csat": 79.2526,
      "mean_wait_min": 9.2914,
      "p90_wait_min": 18.8878,
      "served_per_day": 233.885,
      "step": 3
    },
    {
      "delta_vs_baseline_pct": {
        "mean_wait_min": -80.3004,
        "served_per_day": 6.9975
      },
      "label": "+ Deflection",
      "levers_active": [
        "matching",
        "appointment_smoothing",
        "prep_in_queue",
        "deflection"
      ],
      "mean_csat": 79.5034,
      "mean_wait_min": 8.4345,
      "p90_wait_min": 16.7956,
      "served_per_day": 229.82,
      "step": 4
    },
    {
      "delta_vs_baseline_pct": {
        "mean_wait_min": -79.5746,
        "served_per_day": 7.924
      },
      "label": "+ Running Late",
      "levers_active": [
        "matching",
        "appointment_smoothing",
        "prep_in_queue",
        "deflection",
        "running_late"
      ],
      "mean_csat": 79.4315,
      "mean_wait_min": 8.7453,
      "p90_wait_min": 17.4363,
      "served_per_day": 231.81,
      "step": 5
    }
  ]
}
